,cafe_id,message,point1
2717,1983315941,전망이 좋은 카페입니다.  카페 앞에 바다와 소나무가 있어 아주 좋습니다. ,1
2718,1983315941,계단에서 미끄러졌는데 직원이고 사장이고 아무도 안오고 멀뚱히 쳐다볼뿐 괜찮냐는 사람도없고 미끄럼 주의표시도 없고 직원들 서비스마인드가 전혀.... 아니네요 별점 1개도 아까움,0
2719,1983315941,외국같이 예쁘더라구요 또가고싶어요!,1
2720,1983315941,편안합니다!!,1
2721,573133854,"맛없거나 불친절한건 아닌데, 그래도 7천원 넘는 값 치고는..  특별할거 없는 카페.,",1
2722,162122149,작년에 하와이 여행갔다가 아일랜드빈티지 아사이볼이 유명하다고 해서 이건 꼭 먹고 가야지~맘먹었던 음식중 하나죠!! 중독성이 강한 매력 때문인지 다음날 또 매장가서  주문을 하고 2틀연속 먹었던 기억이 나네요~  우연하게도 제주여행계획 6월에 잡혀 있는데 오픈 넘 기다려지네요~^^   ,1
2723,162122149,하와이에서 먹었던 아일랜드빈티지커피 아사이볼을 제주도에서 맛볼수 있겠네요. 기대가 큽니다.,1
2724,1338197965,"깔끔 친절 
커피테이크아웃3500원",1
2725,1338197965,"카페 이쁘고 친절하심 ㅎㅎ
공항 근처라서 좋아요
베이커리류도 직접 만드신다는데 에그타르트가 진짜 맛있었음",1
2726,1812243909,음료 가격도 비싼데 고양이가 있는 공간이 분리되어잇어서 요금을 내야 들어갈수잇어요. 심지어 입장 요금도 비싸요 거의 만원이엇던가..이건 정확한 가격은 아니지만 비쌌어요.  딱히 편안한 카페도 아니엇고 비추에요ㅠ ,0
2727,1812243909,불친절해요,0
2728,1812243909,"고양이가 있는 공간과 카페는 분리되어 있으며 별도 요금을 내야 접근 가능함
그리고 14세 미만은 캣존에 못들어감
카페메뉴는 그냥저냥",0
2729,1812243909,딸기우유 맛있게 먹고 왔어요~,1
2731,1812243909,"직원들도 친절하고 무엇보다 고양이카페라고 음료에 신경쓰지 않는곳이아니라 커피나 차도 맛나고 다른 소소한 부분까지 정성들인게 느껴지는 카페여서 좋네요. 
심심할틈이없는카페?
너무 예쁘게 생긴 고양이사진 좀올릴게요

ps : 저밑외국인분(Rigard kruger)은 저 있을때 오신분인데 정신 좀 차리셧으면좋겟네요. 외국인이 무슨 특권도 아니고 일인일메뉴에 노키즈존이라고 버젓이 적혀 있는데 대여섯명 우루루 와서 차한잔시켜놓고 다른 손님이 있든 없든 소란스럽게 떠들고 모유수유하고 직원이 제지하니 거기에 앙심을 품어서 저렇게 올렷나보네요. 외국인인건 특권이 아닙니다. 손님이 예의를 갖추는데 직원이 불친절했을까요.
제가 꽤 오래 있엇는데 직원분들 
너무 예의바르고 친절하십니다.
앞에서 항의하거나 클레임 걸 자신은 없으시고 소심하게 댓글로 이러시는건 아니라고봅니다. 애기 이쁘게 생겻던데 다 보고 배웁니다. Rigard Kruger!!!정신 좀 차리시길",1
2732,1812243909,"Treat their customers terribly. Avoid. Gave them benefit of the doubt after one bad experience, but a different staff member on another day was also rude. Definitely not worth coming to.",0
2733,1812243909,고양이들 아주 귀여워요 커피맛도 괜찮아요,1
2734,1812243909,냥이들 너무 귀엽고 커피도 맛있었어요,1
2735,1812243909,커피도 맛있고 고양이들도 귀여워요,1
2736,1812243909,고먐미들 너무 귀엽고 음료랑 디저트도 맛있었는뎅 고먐미가 도지마롤만 보면 먹으려고 달려오니 조심하세요,1
2737,1812243909,주문은 오래 걸리지만 너무 귀여우니 용서됨,1
2740,1812243909,"제주도 협재 카페 ! 요즘 핫한 커피타는야옹이. 커피, 음료도 맛있구 ㅎㅎ 8마리 야옹이들과 시간 가는줄 모르고 놀다가 왔습니다. ㅎㅎ",1
2741,1812243909,우리 야옹이들 보고 힐링하러 가요~ 애교는 없어도 애들이 낯가림이 심하지 않아서 괜찮았네요.,1
2742,778794593,친절하고 음료들도 맛있어요 스무디류 괜찮아요 벽면에 영화틀어놓으시는게 참 분위기있어요,1
2743,778794593,사장님 완전친절하시구  분위기굿 인생사진남길수 있는곳  ,1
2744,778794593,"글쓰러 자주 들리는 카폐입니다. 아담하고 아늑한 기분에 작업 효율이 올라가네요^^ 
음료의 맛도 더할나위 없이 좋습니다.",1
2745,778794593,2층으로 되어있는데 작아요~그치만 분위기 너무좋네요~인테리어도 잘되어있고 조용하게 즐길수있어요~^^  혼자거나 친구들이랑 조용한 분위기를 즐기고 싶으면 여기로 선택하면 딱!!!!!,1
2746,778794593,카페 감성이 너무 조와요ㅠㅠ 하나하나 신경쓴게 다 보였어요!!! 음료도 넘 맛있고 사장님도 완전 친절하십니다ㅎㅎ강추강추 아 그리고 브라우니도 너무 안달고 맛있어요~!,1
2747,19637598,휴업.,0
2748,19637598,노키즈존 :D,1
2749,19637598,커피맛 인테리어 음악 다 좋아요,1
2750,19637598,제주도 최고의 커피,1
2751,19637598,노키즈존,0
2752,19637598,노키즈존...,0
2753,19637598,노키즈존,0
2756,19637598,용두암 용연구름다리 건너 소재한 바닷가 커피집. 경치와 커피는 너무 좋다.,1
2757,19637598,전 커피맛은 잘 몰라 패스. 위치는 용영교가 잘 보이는 곳이라 가만히 앉아서 즐기기에 좋습니다.,1
2760,19637598,"우리나라뿐만아니라 세계에서도인정하는
최고의 바리스타님의 커피를맛볼수있는곳

드립도최고지만 에스프레소가 아주좋습니다
아메리카노추천",0
2761,19637598,제주 최고의 커피맛.,0
2762,19637598,"드립커피 전문점^^  
분위기 좋고 친절하신 바리스타님  
고급스러운 잔 맛 향기",0
2763,19637598,커피맛도좋고 분위기도좋고 바다도보여서 더 좋고 사장님은 굉장히 친절하시고 인심이 좋으시네요 대박나시길 기원합니다^^,1
2764,19637598,커피맛이 예술이에요,1
2765,19637598,분위기도 좋고 커피도 좋고  ^^,1
2766,1828484014,툿섬은 다 좋은데 커피값이 비싼편이고 소파가 불편,0
2768,897536273,"커피가 진짜 맛있었네요, 창밖으로 보이는 감귤밭도 너무 이쁘고, 카페도 편하고 사장님도 친절하시네요. 
나중에 또 커피가 생각나서 다시 오고싶어지는 곳이될것같습니다. 추천합니다",1
2769,897536273,Very cozy coffee shop with amazing coffee and beverages!! Love! ,1
2770,897536273,카페 뒤에 있는 귤밭보고 힐링했어요 ! 사장님이 내려주신드립커피도 최고였습니다 :)),1
2771,638371572,"세상에,,, 쑥 파운드 캐잌 당신은 대체,, ",1
2772,638371572,"한적해서 더 좋았던 공간,,,!!
엄청 친절하신데, 카페 내부 인테리어도 예쁘고
편하게 쉬어갈 수 있었습니당
",1
2773,22673337,옛쎨~♡,1
2774,1791921485,아도록플레이트와 프렌치토스트와 아메리카노 환상조합이네요 사장님도 친절하시고 맛도있어요 분위기깡패 굳굳,1
2775,1791921485,앞마당 이쁨,1
2776,1791921485,"카페 앞마당과 바다뷰가 매우이뻤음.
한라봉에이드 맛있음!! 팬케이크도 양도 넉넉하고 맛있긴했는데 먹다보니 버터가녹아 초금느끼함(평소 느끼한음식못먹는편이라 더그럴수있음) 가격대비약간아쉬움. 사람이없어서 넓은곳에서 여유롭게 즐기다옴 여름,가을에가면 좋을듯",1
2777,1791921485,맛도 좋고 플레이팅도 멋져서 즐겁게 먹었습니다. 브런치로 추천할게요,1
2778,1791921485,팬케익 맛대비 가격이 비싸다. 관광지라 비싼가보다. ,1
2779,1791921485,커피와 당근쥬스가 별로 맛없으면 어떠하리 친절한 가게 분위기와 눈이가는 인테리어 -펄럭펄럭 휘날리는 커텐과 레이스 인테리어 외부의 빈백 넓은 마당 조용한 시골마을에 잔잔한 노래(비록 캐롤은 취향이 아닐지라도) 마당의 흰 강아지-는 좀 인위적이긴 하지만 충분히 감동적. 담엔 꼭 날좋은날 친구들이랑 디저트 시켜먹고 실컨 사진 찍으러 와야지. ,1
2781,1791921485,수무디같이 부드러운 수박주스와 촉촉한 당근케이크 지존의 맛,1
2782,1791921485,비오는 날 평대리에 찾아가서 잘쉬다갑니다! 바다도 잘보이고 정원도 인테리어도 너무 잘되서 이뻤어요!ㅎㅎ아도록이란 뜻도 멋있어요:),1
2783,1791921485,"아메리카노,카페라떼,귤쥬스,팬케잌 모두맛있구요
커피숍인테리어가 특히예뻐서 여자들이 사진찍기죠은 곳이에요
근데 사장님이 가는길에 문앞까지 나오셔서 즐거운여행되세요 라고배웅해주셔서 넘고맙고좋았어요
제주도와서 많이먹고돌아다니는데 다 장사가잘돼서 그런지 어서오세요  소리도 듣기힘든데 이런친절은 처음받아봐요
번창하세요17년10월5일방문함^^",1
2784,624719590,"오가닉여름소다 딸기우유 꿀수박을 마시고
앙버터랑 찹쌀떡을주문했어요
오가닉여름소다 시원하고 적당히달고 개운하니 너무 맛있었어요
딸기우유는 아시는 그맛입니다 딸기청에 우유
꿀수박도 수박쥬스ㅎ 맛있었어요
앙버터도 바삭하고 고소했구요
다만찹쌀떡이 시판찹쌀떡사이에 포도만끼운 느낌
(혹시 아니면 죄송해요) 그냥 그런식감과 비슷했어요
친절한사정님 맛있게 잘먹고 갑니다",1
2785,624719590,세화해변 근처 길 걷다가 우연히 들어간 곳인데 너무 맛있어서 세 번이나 재방문했어요! 모든 디저트가 다 맛있는 곳- 특히 과일찹쌀떡이 엄청 맛있어요 :),1
2786,624719590,커피 맛있어요,1
2787,27411422,오드리를 닮은 고양이가 행복한 꿈을 꿀 듯한 커피전문점이네요,1
2788,1182742651,"올레길 걸은후 이용했는데 너무좋음
한라산 등반후에도 일부러 여기로 버스40분 타고 다시방문ㅎ    족욕중 사장님께서 어깨 마사지 간략히 해주시는데  그것도 엄청 큰 도움 됨 ",1
2789,1182742651,사장님  친절하셔요 물집 잡혔다니까 바늘 주시면서 빼는 법 알려주시고. 그런 분 많았나봐요 ㅎㅎ 차와 함께 나오는 말린 귤도 좋았어요.,1
2791,20635890,좋은생각가치있는 계획오늘도 행복하세요.,1
2792,20635890,"세상에서 가장편한 대화의 장으로
만들어 나가겠습니다. 감사합니다.
~~꾸벅 ~~~꾸벅~~~~꾸벅~~",1
2793,1771624099,당근케익 맛있어요,1
2794,1771624099,바다를 보며 편안히 쉬어 갈 수 있는 분위기의 카페,1
2795,1771624099,여유롭고 뷰도 좋고,1
2796,1771624099,전망 굿. 커피 굿. 케이크도 굿,1
2797,1771624099,"당근케이크도 맛있고 
커피도 맛있고:) ",1
2798,1771624099,펜션깔끔함,1
2800,1771624099,한라산까페보다 당근케잌이더맛나요,1
2802,1771624099,건물이 깔끔하고 케익이 맛있네요~,1
2804,20303654,"올레3코스 걷다가 들어갔어요
화장실도 쓰게해주시고 귤도 주시고
맛난커피도 마시고 귤쨈도 사왔어요
올레3코스는 중간에 화장실도 마땅찮았는데 

우리 올레캠프 회원님들 같이 쉬어왔어요
",1
2805,20303654,"다마스 태풍 구경 왔는데.. 헐~~~ 
이타풍에 커피 파는곳이.. 
그것도 바닷가 바로앞.
사장님의 오카리나 소리에 감동 모드..",0
2806,20303654,편안한 잠자리와 맛있는 커피 그리고 멋진 바닷가~~,0
2807,20303654,"조용한 바닷가 까페에서 시간 가는줄 모르고 커피 한잔 하기에 너무 좋은곳, 민박도 하고 있어서 파도소리와 함께 잠을 청할 수 있을 듯 그리고 매주화요일에 휴무.",0
2808,20303654,동생네 가족과 부모님 모시고 9명이 갔는데 모두 200% 만족하고 왔습니다. 사장님 인심도 엄~~청 후하시고 바닷가가 바로 앞이어서 바다만 바라봐도 힐링이됩니다. 저희가 갔을땐 날이 흐리고 바람도 많이 불었는데 날 좋고하면 돌 문어도 잡을수 있다고 하네요 완전완전 좋아요,1
2809,20303654,포근하고 마음이 평화로운  곳 또가고 싶네요,1
2810,20303654,운 젛으면 돌고래쇼도 볼 수 있는 숨은 공간..^^,1
2811,20303654,빛의 카페이며 일출과 일몰을 동시에 감상할수 있는 명소~가까우면 자주 갈텐데~시제가족과 함께 숙박하고 일출을 함께보고 차한잔하는 이시간이 넘 행복하네요~강력 추천합니다~*^0^*,1
2812,20303654,아침엔 민박집 커다란 창문으로 일출을 보고해질녘엔 1층 카페에 앉아 해가 지는 노을을 보고한적하고 아름다운 풍경에 마음이 편안해지는 곳입니다.또 가고 싶은 곳이네요. 힐링과 휴식이 필요할때 가보세요.,1
2813,20303654,정말 반짝반짝이는 예쁜바다를 카페에 앉아서 여유롭게 즐길수있는 아름다운카페예요. 소품들도 너무 예쁘고 윗층 민박도 깔끔하고 예쁨곳이라서 다음에 또 한번더 방문하고 싶네요,1
2814,378587552,"조용하고 감성도 넘치는 예쁜 곳
사장님도 왕 친절하셔요!",1
2815,378587552,"맛있고 분위기 좋음.
한적한 위치라 더 좋네요",1
2816,378587552,"두 모금 마시고 찍는거라 잘 찍히진 않았지만
플랫화이트 우유 거품 한방울도 없어서 슬펐어요..",0
2817,378587552,사장님 넘 친절하시고 커피도 맛있어요~ 분위기도 쵝오 사진찍어두이뻐욤,1
2818,378587552,"Amazing! Quaint and warm feels.. Fairly priced coffee, good taste too! ",1
2819,378587552,생각보다 꽤 넓고요 방이 여러개로 나눠져서 있어서 좋아요. 인테리어 구경하는 재미가 쏠쏠.. 플레이팅도 이쁘구 사장님 친절하셔요,1
2820,378587552,분위기 굿,1
2822,1632912716,2층뷰 이 세상 뷰가 아니고요,1
2823,1632912716,뷰도 이 정도면 나쁘지 않네요. 근데 창문은 좀 더러워서 깨끗했으면 더 좋았을것 같아용! 우연히 찾은 카페인데 사람도 많이 없어서 너무 좋아요:),1
2824,1632912716,위치가 짱이에요,1
2825,1632912716,"커피가격도 저렴한데 맛도 좋아요!
제주도 거의 6천원 이상에 맛없는 곳도 많은데 여긴 커피맛, 가격, 뷰 다 좋아요",1
2826,1632912716,"수우동 갔다가 커피마시러갔는데 
바다가 바로 보이는 2층 넘 좋았어요! 
사람 바글바글 한데 보다 훨씬 만족해요 강추요

",1
2829,1632912716,사장님 너무 친절하시구 뷰도 괜찮았습니다! 2층까지 앉을 자리 있고 3층은 테라스? 있어요,1
2830,1632912716,"친절하세요^^
저희는 수박쥬스와 자몽쥬스 그리고 바닐라 라떼 먹고있는데 맛있네요^^
뷰가 훤해서 카페훤인가봐요 ㅋ
나이가 들었는지 협재 바다에 가는것보단 
여기서 보는게 더 좋으네요^^
잘 쉬고 있어요 ㅎ 담에 제주오면 또 올께요^^",1
2831,1632912716,"친절하고, 깔끔하고, 맛있고 너무 좋았습니다!!",1
2832,1632912716,조용하고 좋아요~,1
2833,1632912716,바다한잔 커피한잔~ 좋았습니당^^,1
2834,1632912716,카페 분위기가 조용하고 뷰도 좋고 음료도 맛있어서 넘 좋았어요!!! 도민으로서 자주가게될듯~~ ,1
2835,1632912716,여긴 미쳤음 안 가면 협재 간 거 아님,1
2836,1632912716,"바닷가 앞이라서 좋았어요~
깔끔한 인테리어에 사진찍어도 이뻐요~
아인슈페너, 딸기크림라떼
커피와 디저트도 맛있어요~
협재오신다면 꼭꼭 가보세요~",1
2837,1632912716,바다가 보이는 뷰도 좋고 카페도 너무 이쁘고 커피도 맛있어요. 협재에서 카페를 찾는다면 강추.,1
2838,1632912716,아인슈페너 맛나요,1
2839,1632912716,훈남 사장님과 전망이 아주 기가막하는곳!,1
2840,1938789532,"분위기와 맛 흠잡을게 없는 곳 
그리고 그에 비해 정말 알려지지 않은곳
",1
2841,1938789532,분위기도 좋고 음식도 맛있습니다!,1
2842,1938789532,맛있어요흑돼지스튜요ㅎㅎ,1
2844,1938789532,경치 굿 맛 굿 !,1
2845,1202641851,밑에 분 말에 공감하면서 갑니다. 별로입니다.,0
2846,1202641851,"표정부터 말투 태도까지 대박 불친절
돈 쓰러갔다가 기분 나빠지고 싶으면 도전 추천
",0
2847,1202641851,"오렌지타르트 맛있어요
카모메식당 같은 편안함이 있네요
심플하고 깔끔해서 좋아요",1
2848,1202641851,"따뜻한 커피에 곁들여 먹는 브라우니,케익,타르트
옆 만춘서점에서 산 책을 읽으며 편안한 휴식",1
2850,26900356,시내 접근성이 좋음,1
2852,26900356,사람이 많아서인지 대기시간이 긴편이에요,1
2853,26900356,"좋아요 ㅎ 직원들도 친절하시구 ㅎ 자리도 넓어서 좋아요
그리고 한라봉뱅쑈도 주셔서 완전 존맛!!!",1
2854,26900356,저는  매일 이곳 아님 월드컵경기장쪽이라~여긴 평일엔  괜찮은데 주말엔 주차및 관광객 땜에 안와요,1
2858,26900356,"자메이카 블루마운틴 좋와요~~
",1
2860,26900356,관광후 휴식하기 딱좋은공간이네요~~^^,1
2861,26900356,"제주도에서도 스타벅스 찍고!!!
역시 친철 마스코트 스벅!!!!
헤이즐넛 라떼한잔!!! ㅎㅎ",1
2862,26900356,아직은 신규점 같은 분위기 ...깔끔하고 친절하고 좋아요주차좀... 하기 힘든 면이 있지만 그외엔 서비스나 직원 친절이나..완젼 만족합니다 ~^^,1
2863,26900356,차로 테이크아웃 가능하고  10시까지 영업함. 불친절함. -0-,0
2864,218148094,미대 누나가 커피 뽑는 감성 쩌는 카페,1
2865,1032727268,"사장님 넘 맘이 따뜻해보여서

있는내내 편하고 좋았어요ㅜㅜ",1
2866,1032727268,대박 좋아요 강아지 고양이 창문밖 풍경 음료 뭐하나 빠지는게 없음 ㅠㅠ,1
2867,1032727268,유기견돕기 바자회도 열어주는 정말 멋진 곳이더군요!,1
2868,1032727268,제주만큼이나 따뜻하고 향기로운 곳^^,1
2869,1032727268,"멋진 창을 가지고있는 카페는 항상 옳다! 커피맛도 좋다!!
",1
2870,1032727268,뷰도 공간도 너무너무 멋졌던 곳. 진짜 바람이 머물다 갈것같은 카페였어욤~~,1
2871,21025723,개별 방문도 가능합니다. 미리 연락주시고 대여 여부만 확인하세요!,1
2874,258584774,가을에 문 다 열고 바람 맞으면서 마시는 아이스티 개꿀맛~,1
2875,258584774,"상당히 예뻤다
사람이 너무 많아서 아쉬웠던,,
사장님께서 혼자 음료를 만드셔서 바빠보이셨윰

그리구,,
손님 한 팀에 1강아지,,,,(귀엽지만 ,, 가까이 오면 무서ㅂ)

동물을 무서워하는 나는 
사전에 블로그와 후기를 찾아보고 온 곳이지만

내가 못 본 건지,,
블로그에 안 쓰여있던 곤지,,,ㅜㅠㅜㅠ

맛은,, 밍밍밍
바다 뷰는 굿
귀여운카페,,,

",0
2876,258584774,"표선해안도로 드라이브를 하다가 우연히 발견.
날씨 좋은 날 끝장나는 뷰. 당근케잌도 커피도 좋았습니다. ",1
2877,258584774,"친절하신데 당케도 맛있고ㅠㅠ뷰도 멋져요,,,
남원의 매력을 느낄 수 있는 곳!",1
2878,258584774,작년에 이어서 올해도 왔습니다. 진심 마음에 드는 곳이에요. 사장님 정말 친절하시고 짱입니다. 케익 꼭 드셔야해요 솔직히 제주도 카페 비싼편인데 여기는 상대적으로 저렴하고 맛도 굿굿 경치도 굿굿 댕댕이들도 있어요!! ,1
2879,258584774,비올 때 갔는데 확 트인 경치가 넘 좋았고 수제 당근케이크가 훌륭했다,1
2880,258584774,힐링이란 이런것이죠,1
2881,258584774,신흥리 바다 풍경이 참 멋진 곳. 귀여운 강아지들의 살가운 애교에 한 번 녹고 카스테라처럼 보드라운 당근 케익에 한 번 더 녹는다.,1
2882,258584774,"뷰도 훌륭하고 커피맛도 좋아요~~
엄마, 아빠랑 좋은 시간 보내고 왔어요~^^",1
2883,258584774,"닥스훈트 두마리가 귀여워요
",1
2884,258584774,주인이 없어요 한참 기다렸는데 손님만 있고...,0
2885,258584774,너무 좋은 카페,1
2886,258584774,바다랑 가까운 좋은 카페입니다. ^^,1
2887,258584774,"인테리어 음악 전경에서 펼쳐지는 바다...
그냥 멍하니 있는데는 여기만한곳이없음",1
2888,258584774,완전 좋아요! 말이 필요없는 ,1
2889,258584774,"사장님의 커피 플레이팅이 섬세함. 
한적하고 고요함. 바다보며 커피 한 잔 딱 좋음!",1
2890,258584774,한적하고남향이라........ 멍때리기에는딱임다.......................,1
2891,18752674,"일단 일회용품 안쓰려해서 좋고
메뉴도 정성껏 준비하는 것 같습니다. 
빵도 달지 않아서 좋았어요~~
메뉴가 다양하진 않아요~",1
2892,18752674,참 신기한게 제주 이민 초기에 온 업자들 중 손님들에게 무뚝뚝한것을 미덕으로 삼는 이들이 가끔 있음. 서비스 업에 종사하면서 자기들이 무슨 힙스터인 줄 아는 건가? 자영업에 익숙치 않아서 그렇다고 헛소리를 하는 부류도 있고....,0
2894,18752674,"호기심에 가서 나쁘지는 않았지만 맛있는 빵 파는데가 여기만 있는것도 아니고.. 쥔장이 겁나 무뚝뚝. 여행객들같은 뜨내기나 대상이지 한번 갔던 도민은 두번은 안가겠다.
무서워서 뭐 질문 하겠나",1
2895,18752674,"빵, 커피잔, 전체적인 분위기가 가을겨울에 잘어울이는 곳",1
2896,18752674,모르는 커피콩 종류가 메뉴판에 수두룩. 비쌈. 정원 좋고 후추쿠키 맛있네,1
2897,18752674,분위기도 좋았던곳. ,1
2899,18752674,제주에서 찾은 드립커피 카페.,1
2903,18752674,"티 종류 시켰는데 오래된 차 찌꺼기가 베여있었다. 빵 종류는 생각보다 많지 않고 비쌈. 

분위기는 좋으나 그냥 잠깐 쉬어갈만 한 곳. 
",0
2906,18752674,"진짜 우유빙수랑 양많은 드립커피
묘한맛의 후추쿠키까지 굳굳",1
2907,18752674,처음에 커피 참 맛있었는데. 어느순간부터 커피맛 변했어요..,1
2908,18752674,빵과 커피 무엇보다도 가게 외관,1
2909,18752674,목요일 쉽니다. ㅜㅠ,1
2910,18752674,"고즈넉한 오래된 제주도 동네 느낌 가득.
오렌지쥬스에는 오렌지가득
특히 후추 쿠키는 계속 입에서 땡긴다.
또 먹고싶다...
2014.11.7",0
2911,18752674,꽃피자 건너편~~,0
2912,18752674,"좋은 평이 많아서 왔는데 실망. 이름이 빵가게인데 빵이 없다.(다 머핀 쿠키. 시나몬롤은 설탕맛이지 반죽은 아주 엉터리) 심지어 핸드드립커피도 별로다.(예가체프 시켰는데 떫음)
-14.5.5",0
2913,18752674,추천카페,0
2914,18752674,협재해수욕장 근처 까페. 신선한 오렌지주스와 후추쿠키 맛 좋아요! 아직까지도 그곳의 오렌지주스 첫모금 잊혀지지가 않네요.,0
2915,18752674,빵도 진리 후추쿠키도 진리.,0
2916,18752674,^^,0
2917,18752674,진짜 우유를 얼려 만든 우유빙수~ (얼린 우유 부수는 소리를 듣고 알았다) 그리고 드립커피가 참 맛있다. 신비한 커피 맛을 균형있게 잘 표현하는 듯. 추천!,0
2918,18752674,최마담네,0
2919,18752674,농가를 개조해만든 빵집 겸 카페. 아담하고 깔끔한 실내엔 커피향이 가득하다.,0
2920,18752674,블로그빨 비추,0
2921,18752674,저는 빵크기가 크진 않았지만 정말 맛있었고&#38;&#35;40;옥수수머핀&#38;&#35;41; 친절해서 나쁘지 않았습니다. 그렇지만 커피 양이 적은데다 너무 비싸다는 생각이 들었습니다. 빵만 사가시는 걸 추천해드립니다.,1
2922,18752674,"커피는 마실만했으나.. 브라우니는 콩알보다 좀 큰게 나와선.. 달기만 드립다 달아서
꽝이었음.

그냥 커피나 한잔 마시면 될듯.. 굳이 찾아갈만한데는 아님.. 빵을 내세우기에는 역부족",0
2923,22377388,편하게 부담없는 분위기가 좋아요,1
2924,22377388,"크고넓고주차쉽고
편히오기좋아요",1
2925,17414223,매번 진한 커피 향기가 아주 좋아요.,1
2927,17414223,"커피 풀 코스 최고 였어요. 단돈 만원으로 다양한 음료를 먹을 수 있었던 경험. 사장님께서 무뚝뚝해 보이시지만, 인생살이, 커피이야기를 정답게 웃으면서 이야기 해주셔서 너무 즐거웠던 시간이였습니다. 다음에는 19금 커피도 마시러가고 싶네요^^ 다음에 또 방문하겠습니다.>_<",1
2928,17414223,커피풀코스라는 진짜 아이디어메뉴에 감동받고 커피메뉴에 감동받고 ㅎㅎ 사장님의 센스에 많이 웃다갑니다 ㅎㅎ 사장님의 커피사랑이 대단하신것 같아요~ 직접 만드시는 디저트도 하나같이 맛있어요!,1
2929,17414223,워낙 커피를 좋아하는지라... 커피 풀코스로 커피 제대로 즐기고 왔네요~ㅎㅎ 카페 분위기도 좋고 ! 자주가게 될 것 같은 카페 !,1
2930,17414223,아무생각없이 들어갔다가 완전 득템하고 나온 기분이네요~친구들한테도 완전완전 소개해드릴께요~커피풀코스 잘 마시고 갑니다^^ 입이 즐거웠네요~ㅎㅎ,1
2931,914471105,"커피도 맛있고 바다를 바라보는 경치가 베리굿~
산책하다 발견한 나만의 장소랍니다
사장님도 친절해요.오픈전에 가도 기꺼이 커피 내려주시는사장님이예요~~",1
