,cafe_id,message,point1
8099,11539852,"160910 하우스레서피 당근케이크
100% 제주 당근으로 만든 케이크향긋한 풍미의 당근과 시나몬이 만나 중독적인 맛을 탄생시켰다. 마치 찜케이크처럼 촉촉하면서도 쫄깃한 식감이 독특하다. 다소 밋밋할 수 있는 맛이지만 당근 본연의 맛을 음미하기에는 더할 나위 없이 좋다. 머핀과 케이크 두 가지 종류를 판매하고, 케이크에는 크림치즈가 들어가 있다. 하지만 케이크 가격이 저렴한 편이 아니라 부담스럽다면 조각 케이크를 사는 것도 방법. 오후 늦게 가면 없을 수도 있으니 되도록 일찍 방문해야 한다. 참고로 서귀포시 이중섭 거리에도 분점이 있다.


맛은 평범했고... 전문점에서 만들었다기보단 어머니가 손수만든 홈메이드같은 느낌이랄까....???
촉촉했지만.. 작은 조각당 5천원이였는데 이돈주고는 못먹겠다..
차라리..북촌9길빵을 더 사겠다...!!!
북촌9길빵 사장님도 홈메이드로 시작하셨는데 완전 고퀄...",1
8100,11539852,"당근케익
2015.7.1",1
8101,11539852,귀덕해수욕장 근처 역사가 깊은 당근케잌 들러서 당근케잌 한번쯤 맛보는 것도 좋을 듯^^ 사장님 너무 친절하셔 교양있고 기품있으신 할머니 사장님^^,1
8104,11539852,"몇년전에 먹었을때는 크림치즈,당근 빵빵하게 들어있었음. 최근에 갔을때는 반절밖에 안들어있어 실망함.",0
8105,11539852,"당근케이크 맛있다고 찾아온집
특별한것은 못 느끼겠음",0
8106,11539852,하우스레서피 소 루이보스티 아빠 생파,0
8107,11539852,당근케잌,0
8108,11539852,식신로드이재훈편,0
8109,11539852,예정,0
8110,11539852,당근케익 당근쥬스,0
8111,11539852,당근케익,0
8112,11539852,당근 케이크 맛있네,0
8113,11539852,11월여행 방문할 곳!,0
8114,11539852,맛있는 당근 케익 곽지해수욕장 협재해수욕장 사이,0
8115,11539852,맛있는 당근당근케익,0
8116,11539852,당근케익 추천 ! 담백한맛이 일품,0
8117,11539852,당근을 주거라 시러하는 내가 추천하는 당근케익 ㅋ,0
8118,11539852,"푸근한 느낌의 가게~
옛 할머니의 따끈하고 부드러운 당근케익~
달지도않고 같이나오는 루이보스티와함께 일품이다!!
주인의 친절함과 따스함이느껴진다!",0
8119,11539852,당근케이크~ 필라델피아 크림치즈와 당근과 계피향이 묘하다... ^^,0
8121,11539852,당근케이크 늦으면 못 삼,0
8122,11539852,"이미 알만한 사람은 다안다
필라델피아 치즈가 스며든 당근케익
먹어보자",0
8123,11539852,"너무너무맛있는 당근케익,머핀~제주 구좌읍 당근으로만듬! 가끔 찰떡 케익도 주문했었는데 그거슨 진리!!",0
8124,11539852,"제주 당근케이크~
미리 예약하던지 일찍 가야함~
무작정 들르면 맛보지 못할 수도,
사장님 내외분과의 대화도 즐거웠고,
가게 길건너편 동네 산책도 추천!!!",0
8125,11539852,완전 맛있는 당근케익,0
8126,11539852,사장님은 친철하심. 후기를보니 맛을 일정하게 유지하지 못하는듯. 당근 단맛에 따라 설탕도 좀 넣야하지않을까요? 제가 사먹은 날은 반죽문제인지 케익이 아닌 떡이었어요. 건강빵컨셉이라도 어느정도 맛은있었으면,0
8127,11539852,커피가정말 맛있네요!당근케이크도 건강한 맛! 안에 치즈가 들어있고 당근의단맛이 커피와 궁합이 딱이네요. 가게에 좌석이 많지는 않고 좀 너저분?해보일수도있는데 그냥 시골집온것같고 정겹고좋네요ㅎㅎ,1
8128,11539852,"가게 찾기도 어렵고, 주차공간도 없고, 가격도 빵퀄리티보다 비싸요~ 요새 빵집 맛난곳들 많은데~~",0
8129,11539852,방송나오고 유명하다해서 가족과 함께 추억 만들려고 갔는데 일단 넘~불친절하고 맘 상했습니다  두번은 안갈듯ᆢ 맛은 일단 맘 상해서 먹고싶지않았습니다 장사가 잘되어그런지 친절은 찾아볼수없었고 맛도 보통~~,0
8130,11539852,절대 가지마세요..ㅜㅜ 이런 잘못된정보가 제주도맛집전체를 호도하고있는거 같네요..주인도 폭리를 취하는 노회한 분들같고 요새 그런 빵맛으로 돈받고팔다니..그것도 비싸게..누가 추천글을 올렸는지몰라도 ㅠㅠㅠ,0
8131,11539852,"꼭 리뷰를 쓰고싶었어요. 겉은바삭,속은 촉촉 . .그러나 정말 맛은 별로였습니다 . 2만5천원이 아까운듯..ㅠㅠ ",0
8132,11539852,완전 별로....,0
8133,11539852,저는 완전 별로....,0
8134,11539852,완전 최고 ~~~ 사장님도 멋지시고 손수 만드신 당근 케익은 정말 짱입니다.,1
8135,11539852,특히 당근케익속 치즈가 일품~~~완죤히 귀덕리 당근케익 왕팬이 되었습니다~~또 먹고 싶다~~,1
8136,11539852,당근케잌도 넘 맛있게 잘 먹었습니다. 많이 달지도 않고..잔뜩 사가지고 와서 나눠먹었는데 다들 맛있다고 칭찬이 자자했답니다...사장님 잘먹고 이야기도 넘 좋았습니다~~행복했었습니다.,1
8137,11539852,"사장님과의 잠깐의 대화였지만 넘 인상적이 셨어요.  제주의 환경 보존을 위해 구체적으로 계획하시고 실행하시는 진정한 제주인, 한국인의 애국자이셨습니다.특히 화장실??",1
8138,11539852,많이 달지도 않고 괜찮네요 ㅎㅎ 건강에 좋을거 같아요,1
8139,11539852,저는 먹을만 하던데요~ㅎㅎ 근데 홍보가 덜 돼서 아쉽네요,1
8140,11539852,특이한 당근케익을 맛 볼 수 있답니다~맛은 그럭저럭...입에 맞지 않을 수도 있어요~가격도 조금 나간다는 사실~!,1
8141,11539852,밖에서 보면 그냥 지나치기 쉬워요. 외관이 좀 아닌듯!! 당근케이크라는 특별함이 있지만 제주에서는 잘 살리지 못하고 있습니다. 도로변에 있지만 휫~!! 지나갈 수 있어요. ,1
8142,11539852,여기 소개가 잘못 나온 거같네요~ 제주도에 있는 곳이랑 서울에 있는 곳은 분위기가 아주 다른데..제주도에 있는 곳은 거기서 먹고 오기는 좀 그런 분위기고 당근 케이크야 아주 건강식인데 넘 비싸요,1
8143,276626600,여기 분위기 진짜 좋아요 파스타랑 문어라면도 비싸긴 하지만 맛있었어요,1
8144,276626600,너무 맛이 없는 식당.. 전복에서 그렇게 비린내가 심할 수 있는지 그리고 파스타에서 소금이 씹히고 트러플오일파스타였는데 트러플향은 전혀 안나고 ,0
8145,276626600,"명진전복 웨이팅하던 중 지나가는길에 들렀는데 분위기가  만점입니다. 더운날 들러서 시원한 맥주 먹기 딱이네요.
아래의 리뷰와 다르게 리모델링 된듯 하네요.",1
8146,276626600,"전복 조그만거 하나. 문어 몇조각 끝. 
가성비보다 더 심각한건
아주머니가 눈도 안마주치시고 반말로 그릇 가져오라고 시키시고 돈은 현금으로 내라 하신다. 

자리 좋은 것 믿고 장사하시는 건가.. 불친절하고 가격대비 만족도도 없고. 
그 자리가 너무너무 아깝다.. 열심히 정성스레 음식만드시고 서비스하시는 분들도 많은데..",0
8147,276626600,"전복 하나 들어간 라면 13,000
문어 여덟 조각 들어간 라면 13,000
제주 살며 가본 식당 중 최악",0
8148,26303350,둥둥라떼랑 매실차 허니브레드 반쪽짜리 먹었어요! 음료도 다 맛있고 허니브레드도 딱 반쪽짜리가 있어서 좋았어요 ㅎㅎ 밤에가고 비가와서 테라스에 오래 있지는 못했지만 맑은날 낮에가면 너무 이쁠것같아요ㅠㅠ 재방문 의사 완전 있습니당!! 둥둥라떼 또먹고싶네요 굳,1
8149,26303350,"달자가 이름이 달자래서 달자라는... 너무나 조용한 달자
아이스크림과 라떼의 맛난조합-둥둥라떼
시원한 뷰 잘 쉬다 갑니다
",1
8150,26303350,맘에 들었어요,1
8151,26303350,연유라떼 애플망고스무디 아메리카노 다 맛있어요 친절하고 가게 내부도 예뻐서 좋지만 무엇보다 뷰가 진짜 최고:)!! ,1
8152,26303350,"둥둥러떼맛있어오 ㅠ 
늦게까지하는것도 너무 좋고!
친절하시고 분위기도 좋네요^^",1
8153,26303350,"둥둥라떼에 아이스아메리카노 단호박타르트 먹었습니다.
둥둥라떼에 아이스트림도 많구 아포카토인듯 티라미수같은 느낌도 나고 맛있었습니다~~~ 단호박 타르트도 좋았어요
카페 분위기도 좋고 뷰도 정말 좋아요 !!",1
8156,26303350,주차장넓직하고 애월바다뷰좋으며 마당에서 인절미가 반겨준다. ,1
8157,26303350,"가격대비  뷰 좋고 음식과 음료의 양 넉넉하
해요.",1
8158,26303350,자리 잘 잡았다,0
8160,26303350,"딴건 모르겠고
뷰랑 리트리버",1
8162,26303350,"아름다운 애월바다를 제대로 감상할 수 있는 멋진 카페
1층. 2층. 야외도 있어서 3군데에서 바다를 감상 가능",1
8163,26303350,"전망 양호, 2층 건물,  여름  팥, 망고빙수  ₩13,000",1
8164,26303350,바다가 바로 보여서 좋았어요~~사장님 친절하셔요!! 커피랑 디저트도 맛있어요~,1
8166,26303350, 주차하기 편해서 들어갔다가 날씨가 너무 좋아서 2층 볕 잘드는 창가 자리서 생각없이 바다바라보고 왔네요. 혼자가도 부담없이 앉아있기 좋아요. 메뉴가 너무 다양하지만.. 저는 그냥 적당히 달달한 라떼가 좋았습니다. ,1
8167,26303350,"여유있게 바다보기 좋고, 바람쐬기 좋은곳~!
특히 밀크티가 맛있었어요. ",1
8168,26303350,"날씨도 굿! 카페도 굿! 커피도 굿!
좋은곳을 발견했다 !!
사진도 이쁘게 나오고 넘나 좋다 요기",1
8170,26303350,"외관이 이뻐 들렸는데 사장님의 아기자기한 센스가 돋보이는곳이였어요♡ 비가와서 아쉬웠지만 비오는 애월바다도 참 운치있었어요, 케익도맛있고 남친이랑 둘다 라떼종류로 시켰는데 정말 맛있었어요! 애월또가게되면 꼭 들리고싶은 곳이예요^^",1
8171,26303350,라떼 추천~~!!,1
8172,26303350,밖에서 볼때보다 안에들어가서보면 뷰가 넘 조아요~~ 2층에서보면 바다에떠있는느낌이 하지만 갠적으로1층이더 좋네요^^,1
8174,26303350,"160910 바다를 달리는 자전거 달자카페
카페마니와 비슷한 컨셉으로 바다를 누워서 볼수 있게 해놓았다. 제주도에서 가장 좋아하는 바다풍경을 담은곳. 커피맛은 쏘쏘함!",1
8175,26303350,낮에 가면 뷰가 끝내줄듯~,1
8176,26303350,밤바다 볼 수 있을까 하고 갔는데 너무 깜깜해서 바다도 못보고 차만 마시고 돌아옴~,0
8177,26303350,"밖으로 보이는 바다가 너무 이뻐요
애월카페중 꼭가봐야하는 카페인듯요^^",1
8179,26303350,뷰가 정말 환상입니다~ 커피도 맛나요 ^^,1
8180,26303350,사람이 많지않아 조용한 시간을 보내기 좋은곳 ,1
8181,26303350,"풍경이 참 좋다.
유명하지 않아 조용해서 더 좋은곳.
커피맛은 보통.",0
8182,2132065667,"넘나 맛나고 분위기도 좋은 새우 레스토랑!
정말 최고예요.
카페에서 shrimp
레스토랑으로 바뀐듯 해요.
가격도 정말 나이스 나이스!",1
8183,2132065667,아메리카노 맛있었어요^^,1
8185,23182795,초코빙수 맛나고 수제츄러스라 맛나고 ㅋㅋ직원분들이 친절하신게 생각나서 다시한번 검색해보네요:&#41;,1
8186,185339038,음료 맛있고 밤엔 분위기 또한 좋은 카페,1
8187,8042333,시청 쪽 프랜차이즈 카페치곤 한적하고 조용한 편. 그런데 여자 사장님(?)인지 알바가 좀 불친절하고 퉁명스러움 ㅜ,1
8188,8042333,인테리어 개선 시급해보임,0
8190,8042333,싼 맛에 가는 커피숍~그렇다고 별로라는 건 아닙니다~!!,1
8191,8042333,커피맛을 잘 알지는 못하지만 카페라떼 조금 별로에요~그리고 인테리어가 조금 별로인듯해요~,1
8192,8042333,반대편에 더 잘되는 가게가 있어서 이집이 그나마 사람이 적어요 그래서 조용하고 좋아요,1
8193,8042333,커피맛이야 거기서 거기지만...인테리어 바꾸어여할듯...,1
8194,8042333,커피맛이 좋은지는 잘 모르겠으나 의자가 좀 불편해요..,1
8195,8042333,시청에 커피전문점이 많은데요. 개인적으로는 비추입니다. 맛도 그렇고 실내도 그렇고 별로에요~ ,1
8196,8042333,"가격은 저렴 하지만, 분위기는 좀 별로 인듯 .. ",1
8197,8042333,분위기는 별루지만.. 가격저렴.. 커피맛 괜찮은 ,1
8198,8042333,가격 괜찮고 장소도 좋고 가게 분위기도 아늑해서 좋고 커피 맛도 무난합니다..아주무난한 커피숍.,1
8199,8042333,가격대비는 좋아요. 화장실 냄새만 좀 없애주면 좋을텐데. ,1
8200,8042333,인테리어는 별로지만 커피맛은 그 앞 커피숍보다는 맛있어요~ 2층도 있는데 넘 횡한 느낌..공간을 잘 못살리는 거 같아요 ,1
8201,8042333,합리적인 가격의 맛좋은 커피란  평이 딱이네요. 분위기도 아늑하니 좋고~ ,1
8202,986232032,진저라떼 까눌레 맛있네요 분위기도 깔끔하고,1
8203,986232032,주인분이 정말 친절하시고 까눌레가 맛있습니다!,1
8204,986232032,"밥 먹어도 디저트 2개 이상은 시키는 곳이에여
까눌레가 참 맛있어요
공간이 따스하다는 말이 참 잘 어울리는 곳!",1
8205,986232032,사장님이 너무 친절하시고 겉은 바삭 속은 쫀득한 까눌래가 이곳을 다시 방문하고 싶게해요! 정말 맛있고 공간이 너무 따듯해서 벗어나기 싫엇어요 ㅎㅎ!! ,1
8206,986232032,"까눌레 먹고 싶어서 갔는데 맛있어요! 근데 밑바닥이 조금 탔네요.. 바닐라, 얼그레이 둘다 맛있어요",1
8207,986232032,까눌레 존맛탱!! 다쿠아쿠(?)라는 바닐라아이스크림이 사이에 들어간 다쿠아즈 메뉴도 어마어마함! 달달한 디저트메뉴랑 커피가 너무 맛있었음! 사장님들도 친절하시고 펫프랜들리카페라 멍뭉이들도 있었음ㅋㅋ개인적으로 너무 좋았던 카페! 가면 자꾸 메뉴 3개이상 시키게 되는카페ㅋㅋㅋㅋ,1
8208,986232032,"분위기도 좋고, 까눌레도 맛있어요.",1
8209,986232032,"분위기 좋음
맛 음..?
양 작음
가격 비싼편
까눌레가 맛있다고해서 멀리서 굳이 찾아갔는데 바닐라 까눌레는 겉이 바삭하고 안은 촉촉해서 정말 맛있었지만 말차와 소금캬라멜은 바삭하지않고 맛도 텁텁하거나 너무 짜거나ㅠ.. 크기 굉장히 작은데 세개 사니까 9천원.. 삼천원꼴.. 맛있으면 괜찮은데 바닐라빼고는 별로라 값어치를 잘 모르겠다. 기본 아메리카노가 5천원. 안에 인테리어는 통창이 이뻤고 이외에는 정갈하며 큰 특징은 없는편.. 일단 외관이 가장 예쁘다.",0
8210,986232032,직접 만든 생강청으로 내어주시는 따뜻한 진저라떼 한 잔 진짜 최고에요!!,1
8211,986232032,What a lovely space! Their cannel&eacute; is delicious too!,1
8212,986232032,친절 개 있음 ,1
8213,986232032,까눌레가 참 맛있었어요. 공간이 너무 예쁘고 나오는 노래도 취향저격이었어요. 지쳐있던 마음을 감성으로 채우고갑니다,1
8214,1858538846,"표선 살았으면 단골했을거에요. 
적당히 친절하셔서 편한 사장님과 최고개냥이 반이. 그리고 화목난로. 바다 앞 야외 테이블. 아늑한 2층자리까지 너무 좋았어요:) ",1
8215,1858538846,"표선카라반에 옆에 있는 카페 회상. 
큰 창고를 리모델링했는지 천장이 높고 
목재로 인테리어가 되어있어서 편안한 
공간연출입니다. 에어컨에 써큘레이터 빠방해서
엄청 시원하네요. 카라반국수에서 고기국수먹고
여기서 차한잔 마시고 쉬다가 바닷가로 가면 딱일듯..",1
8216,1858538846,"카페가 캠핑장 분위기로 꾸며져있어요. 바닷가 근처라서 좋고 야외 테이블도있어요! 고양이도 너무 귀여워요ㅠㅠ 사장님 정말 친절하시고, 가격대도 제주도 바닷가뷰 카페인데 불구하고 저렴한편이었다고 느꼈어요. 표선쪽 가신다면 한 번 가보시는걸 추천드려요. 분위기 짱!",1
8218,1858538846,제주에서 가장 분위기 맛이 좋았던 카페 였던것 같습니다 ^^ 사장님도 너무 개성있으시구요 ,1
8219,1858538846,"밑에 1점 평은 주변 커피숖 사장님인가?
제주 돌아다니면서 먹은 커피중에 젤 맛있었어요.
엄청 친절하고 아기고양이 너무 귀엽고 강아지 정말 잘생겼어요. 바닷가랑도 연결되어 있어서 바다 놀러가실분은 놀러가고 안가실분들 앉아있기도 좋겠네요.
참고로 옆에 고기국수 집도 맛있어용. ",1
8221,1858538846,"분위기 너무 좋고 마당도 있어요
커피도 원두 세종류 다 짱맛잇어요
심지어 커피를 쏟았는데도 한잔 더 주셨습니다 ㅜㅜㅜㅜ 죄송해요",1
8223,1858538846,싸가지가...ㅎㅎㅎ,0
8225,26874310,완전 최고 !!!!!!!!!!!!!,1
8226,26874310,"근처 스벅 자리 없어서 왔는데 스벅에 있을 이유가 없었어요. 시그니쳐 메뉴와 케이크가 맛있고, 뷰와 인테리어가 좋습니다. ",1
8227,26874310,"뷰좋아요 통유리창으로 바다가 시원하게 보여요 커피는 컵이 너무뜨거뤄서 손데이는줄 ㅠ 
의자는 불편합니다 
조용한 분위기",1
8228,26874310,11월 말에 왔을때랑 1월 말 지금 기준으로 여기 영업안합니당,0
8229,26874310,바다 보이는 뷰 친절한 직원들 맛있는 음료 상대적으로 지디카페쪽보다 덜 혼잡스러워서 좋음,1
8230,26874310,Coffee,1
8231,26874310,바다가 보이고 당근케이크가 감동입니다.,1
8232,26874310,"바다뷰와 조용한 카페분위기.
일 월 휴무 입니다. 주 5일제 카페.^^~",1
8233,26874310,"조용하고 커피도 맛있는 곳, 바다 바로 앞에 있어서 뷰도 좋아요!",1
8237,26874310,미숫가루 망고쥬스 다 맛있고. 테이블도 많지 않아서 딱 좋아요. 앞에 바다도 훤히 보이구요.!,1
8240,26874310,"바다 전망 최고네요. 조용히 앉아 여행의 피로 풀고, 여유로운 느낌이 참 좋으네요. 멀리 바다가 아른거립니다. 비오면 더 좋을 듯싶네요",1
8243,26874310,"어우~ 좋아요 정말
사장님도 좋으시고 당근케익 짱짱❤",1
8244,26874310,엄청 아기자기하고 디테일이 살아있는인테리어와 디저트도 엄청맛나요,1
8245,926433412,"개성있는 까페. 
들려볼만함. ",1
8247,926433412,성산일출봉 근처 호텔에 묵었다가 잠깐 들렸는데 너무 아기자기하고 귀여운 캐릭이 많네요~~~,1
8248,926433412,맛있는 청귤 막 따왔다고 추천해주신 청귤음료 진짜진짜 맛있었어요ㅎㅎㅎ 키라도 이쁘고ㅜㅜ 우도 갔다가 오는 길에 들렀는데 좋았어요! 고양이 소품들도 귀엽고 다음에 또 갈게요ㅎㅎㅎ&lt;3,1
8249,926433412,"고양이에  관한
소품
캐릭터 상품 
기념품
카페도 겸해서 운영합니다.
냥이 키우시거나
특별한 선물을  찾고 계시다면~
묘한 이곳으로~~~",1
8250,27445248,대체 언제가 여는 날인지.... ,0
8251,27445248,한적한 곳이고 조경도 잘해놨어요. 하지만 좀올드한 느낌. 젊은사람은 안갈 듯 해요. 애견동반 된다해서 가긴 했지만 직원도 그리 친절한 것도 아니고ㅜㅜ 전 다신 안갈듯ㅇᆢㄷ,1
8252,27445248,날이 좋아선지 밖에 풍경도 예쁘고 감귤 비앙코도 맛있어요~,1
8253,27445248,리드줄 짧게하면 강아지 내부 동반 입장가능해요! 커피가 맛있는데 치즈케익은 특히 맛있어요!!!,1
8254,27445248,함덕카페 수제자옹청 사용 자몽에이드,1
8255,23727274,솔직히 공차 자체가 맛없는 브랜드이고 시청 쪽 버블티 하는 카페가 여기밖에 없어서 장사는 잘 되는데 가게 인테리어도 후지고 알바도 느리게 음료 제조하고 펄도 적게 줌,0
8256,23727274,사람들 일하기싫나봐요,0
8257,23727274,처음 생겼을 때 도에 소문난 바로 그 집,1
8260,1672417180,마카롱 너무 맛나요,1
8262,1672417180,"김념해수욕장에서 서핑과 스노클링가능. 커피와 와플, 장비대여, 강습이 포함된 가격입니다. 마음껏 즐긴 후 디저트먹을 수 있구요. 카페 매니저님, 강사님께서 매우 친절하십니다. 저는 서핑욕심에 공항도착시간 맞추기 아슬아슬하게 끝냈는데요. 늦을까봐 버스 정류장까지 차로 태워주셨고 디저트도 포장해주셨어요. 너무 고마웠습니다. 제주가면 다시 가고 싶네요",1
8263,571671874,"지나가는길에 들렷어요
깔끔햇고
떡 맛이 순하고 쫄깃해서 제취향에 맞았어요",1
8264,571671874,"협재해변 놀러왔다가 들려봤는데 내부가 깔끔하네요
딸기수제청우유랑 오레오떡바를 먹었는데
맛이 괜찮아요~ 
마당에는 강아지도 있는데 사람을 무척 따르네요ㅋ",1
8265,217787831,사악한 가격. 바닐라라떼 구천원ㅡㅡ뷰는 좋으나 두번은 별로? ,0
8266,217787831,"분위기 극강임. 바다와 산이 한눈에. 정말 최고였음. 다만 음료 가격은 너무 비싼데, 경치값이라 생각해야 속 편할듯.",1
8267,217787831,"가격은 너무 비싼데 맛과 양은 그저그랬어요 경치만 좋았어여 아래 6/22 하루간 비슷한 내용의 후기 폭탄 뭔가요..지인분들이신지 ,,",0
8268,217787831,가격이 너무 비싸지만 정말 원앤온리한 카페네요 ㅋㅋㅋ산방산뷰 대박...,1
8269,217787831,"사진으로 닮기지 않던 산방산, 그리고 알려지지 않았던 제주에서 가장긴 백사장인 황우치해변을 홀로품은 곳. 차에서 내리고 주위를 둘러보는 순간 저처럼 입이 떡벌어 지는 경험을 하시리라 장담합니다. 압도적이었습니다.",1
8270,217787831,산방산근처 유명한 카페라 갔는데 흠.. 오렌지잼라떼인가?? 가격은 비싼데 맛이 값어치를 못하는.. 다른거 드세요. 산방산케잌은 맛은 괜찮은데 비싸요. 뷰값이라 생각했습니다. 주차장은 넓은데 차도 엄청 많이 오네요. ,0
8271,217787831,모래밭에 차가빠졋는데 남원읍 사는 총각삼촌들이 밀어서 차가빠져나왓어요 고마운삼촌들 진짜고맙구 수고많앗어요,1
8272,217787831,"커피 씀...
산방산케이크 별로...
샐러드 그냥저냥
경치는 좋음",0
8273,217787831,"바다다 같은 분위기로 풍경깡패, 가격이 비싼편이지만 이런 뷰라면 더 받아도 됨",1
8275,217787831,"카맵도 이제 돈주고 평점 올리는거 가능한가봐요ㅡㅡ
좋을거같아요 이건 뭐야 지인?ㅡㅡ
홍보 싫어서 찾아보는 사람들한테 참.. 실제로 가본사람만 쓰게 시스템 좀 바뀌었으면 합니다.ㅡㅡ
분위기 굿
맛 보통
양 적음
가격 사악
2점은 모두 풍경 점수. 풍경은 좋은데 그 외적인것이 안좋음. 쁘띠갸또 케익 작은것은 만원이 넘어가고 아메가 7천원. 유명한 바가지카페 바다다 카페랑 차이없음. 관광객입장에선 정말 날 좋은날 잘 골라서 사진 한번 찍으러 가기는 좋지만, 역광때문에 그렇게 잘 나오진 않음. 개인적으로 이런곳 가지말고 광치기 스벅가셈. 관광객도 가기 좋은 풍경에 어쨌든 가격도 합리적.",0
8276,217787831,힐링의 명소가 되길....,1
8277,217787831,view &amp; coffee,1
8278,217787831,풍경도 좋고 서비스도 좋아요.^^,1
8279,217787831,"뒤엔 산방산 앞엔 바다..
바다 보면서 여유로운 시간 !!
지인 추천으로 왔는데 대만족입니다~~
뷰는 말할것도 없이 최고였고 음료도 너무 맛있네요 ㅎㅎ
매장이 전체적으로 너무 이뻐서 여기저기 돌아다니기 바빴어요
도민인데도 여행온것 같은 기분이에요~ 강력추천해요!!!!!",1
8280,217787831,날씨가 좋을때 더욱 예쁜 카페입니다 주변에 다른 건물들이 없어서 자연 그대로를 느낄 수 있는게 원앤온리만에 매력이네요! 2층 루프탑에서 보는 전경은 진짜 최곱니다ㅜㅠㅠㅠ,1
8281,217787831,"산방산과오션뷰를가진 원앤온리
뷰 진짜 이쁘고!!!!!!!루프탑에서 힐링했습니다
저녁에갔을때는 선선하고 노을질때 너무 이뻐요!!!
낮에도 흐릴때가면 신비롭고!!! 맑은날은 진짜 뷰가 열일열일 하더라구요
꼭 한번 가길 추천해요
브런치와 디저트 음료모두 존맛탱:):):)겁나 이뻐
뚜벅이는 버스에서 내려서 20분만 걸으면 되더라구요
가는길마저 너무 이뻤어요",1
8282,217787831,제주도 서귀포에 최고의 풍경을 자랑하는 원앤온리카페입니다!! 산방산 마운틴뷰와 황우치해변 오션뷰를 동시에 즐길 수 있어요 디저트와 브런치도 맛있고 분위기 갑! 또가고싶네요*^^*,1
8283,217787831,"제주도 원앤온리에서 누려보는 힐링 사치
바닷바람 산바람에 저절로 행복해짐

몇번을 가도 음료도 브런치도 디저트도 다 만족스러워요!
갈때마다 인테리어가 조금씩 바뀌는 것 같은데
사장님의 부지런함과 센스 칭찬해요
킬포가 많은 원앤온리! 또 가야지
#산방산#황우치해변#용머리해안#원앤온리#뷰맛집",1
8284,217787831,새로생긴 핫플카페 다시오면 한번 더 가고싶은 카페~!!,1
