,cafe_id,message,point1
5477,20126145,"매우매우 친절하심
고양이 두 마리 있는데 넘 귀여움
딸기아이스크림 맛있음
강아지랑 가기 아주 좋음
",1
5478,20126145,"북태평양 오션뷰 멋진 카페
뒤에는 산방산
이게 바로 배산임수
시원한 바닐라라떼와 함께 즐기는 신선놀음",1
5479,20126145,"커피와 핫도그 둘다 만족스러웠고 
그것보다 땅콩아이스크림이 너무 맛있었다.",1
5480,20126145,"지금 먹고있는데 진심  맛있어요 다른곳 땅콩아이스크림보다 더진하고 고소하고 맛있어요 망고쥬스도 백프로 진하고 맛있어요 
너무맛있어서 땅콩아이스크림은 아쉽게도 다먹었서 사진이 없네요",1
5481,20126145,"길고양이가 가게 앞에 많음. 애들이 다 안 도망가고 애교를 잘 부려서 귀여움이 폭발함

천혜향인가 한라봉 에이드가 갑임
",1
5483,20126145,사장님이 매우 친절하세요. 비와서 추웠는데 따뜻하게 몸 녹이고 갔습니다. 창가 자리가 경치 좋아요.,1
5484,20126145,산방산에 있는 절을 둘러보고 내려와서 써니 커피숍에들렀다.향긋한 모카커피 마시며 용머리 해안 바다를~~사장님께서 비스킷과 감귤 스무디를 써비스로 주셨다.ㅎㅎ감사합니다,1
5485,20126145,사장님 친절하시고 컵도 예쁘고 경치는 세계제일입니다~,1
5486,20126145,"아침에 용머리 가시면, 써니하우스에서 핫도그 세트메뉴 추천! 핫도그 정말 맛있어요. 아침 세트메뉴 가격도 저렴해서 허접한 핫도그 일줄 알았는데, 풍미짙은 소스에 금방 볶은야채의 신선함, 도톰도톰 소세지 _ 음료선택도 다양하고, 레모네이드 는 직접 진하게 짠 레몬이신가봐요 신선한 레몬향에 깜짝 놀랐어요. 지금껏 내가 먹은 레몬네이드는 다 가짜였구나 싶었습니다",1
5487,21160031,"벌써 3번째 방문,, 서귀포 올때마다 옴. 정말 맛있는 커피가 먹고 싶을땐 추천,, 가격도 넘나 착하다 직원들 항상 너무 친절. 단점은 먹고 가기엔 가게가 좁고 붐비고 음악은 넘나 정신 사납다는 것",1
5488,21160031,기대보단 못한 맛,0
5489,21160031,"다들 평이 좋네요 ㅋㅋ
왜? ㅋㅋ 맛을 떠나 가게가 좁네요 ㅋ
시장통인줄^^커피맛이 좋다?
A타입..B타입....그냥 소소 했습니다~~개인취향이겠지요 ㅋㅋ",0
5490,21160031,so gooooooooooood,1
5491,21160031,비엔나맛있어요~,1
5492,21160031,"예전에 따듯한 카페모카 마셨는데 맛있었어요.
종종 생각날 정도로요.
완전추천.",1
5493,21160031,"A = 커피가 아니라 차를 마시는 듯한 향 + 가벼운 산미
&lt;시그니처&gt;
B = 밸런스 타입 가장 익숙한 맛
C = 산미가 억제된 견과류 오트밀 같은 맛

A와 초코 크로아상의 조합은..
긴말이 필요하지 않음.",1
5495,21160031,"재작년에 방문하고 두번째 방문인데 진짜 맛있어요ㅠㅠ
솔직히 첫 방문에는 이정도 감동은 아니었는데 이번에 소이라떼 먹었는데 정말 맛있었습니다 :) 소이라떼는 원두가 B타입으로 고정되어 있다고 하네요! 원래 선택하려 했던 원두도 B타입이었어서 딱 좋았습니다. 엄마는 아메리카노 B타입으로 드셨는데 맛있다고 하셨습니다! 하지만 전 소이라떼가 제 취향에 맞았습니다. 그리고 크로와상도 맛있었어요ㅠㅠ 커피랑 잘 어울리는 느낌ㅠㅠ특히 초코덕후인 전 초코크로와상이 더 좋았습니다! 다음에도 소이라떼 또 먹고 싶어요!",1
5496,21160031,"커피 별점 4.5

아이스 아메리카노 A타입. 정말 좋은 커피다. 산도도 적당하고 밸런스가 좋다. 블랜드 빈이라 정확하게는 모르지만 에티오피아산 특유의 향이 잘 살아있는 것 같다. 무엇보다 샷을 내릴때 미분이 적게 나와 뒷맛이 씁쓸하지 않아 너무 좋았다. 얼음이 녹아 묽어졌을 때는 너티한 느낌이 살아나 고소한 맛을 느낄 수 있었다. 

C타입도 한모금 맛 봤으나 메뉴에 적힌 대로 산도가 적고 너티한느낌이 났지만, 싱글 오리진 케냐나 콰테말라산 콩들에서 느낄 수 있는 꽉 찬 너티한 향은 많이 느껴지지 않았다. 

커피와 같이 먹었던 플레인 크로와상도 따듯한 버터향 나면서 고소하고 맛있었다. 제주도에 가면 꼭 다시 들를 생각이다.",1
5497,21160031,가격도 적당. 커피맛굳. 다만 좁다.,1
5498,21160031,맛있어요,1
5499,21160031,"아메a타입, 소이라떼 주문함. 소이라떼의 두유가 무가당이라 바닐라를 추가해주셨는데 프렌치 바닐라 느낌. 아메 a타입은 내입맛엔 신맛이 강했다. 담엔 고소한 c타입으로 먹어봐야겠다. ",1
5500,21160031,"제주도에서 제일 잘난 커피,
송산동커피 추천하구요- 
아메리카노는 말할 것 없습니다-
매장두 앤틱하구, 근데 10월 8일 저녁에 모기는 웬 말... 
별점 5점 만점에 6점 드리고 싶습니다.
유동커피!!!!!!! 또 올거예요.",1
5501,21160031,이틀연속 갔는데 또 가고싶네요. 따뜻한 아메리카노A는 인생커피였습니다. 까페에서 사용하는 모든 물품에 다 사장님 캐리커쳐가 그려져있는걸로 봐서 개성과 자기애가 강한분 같습니다.,1
5502,21160031,"숙소 옆이라 아침저녁으로 들렸는데
커피 맛있네요!!",1
5503,21160031,그냥 끝이다. 오직 커피 좋아하는 사람이라면 무조건 가야함. 서귀포 최고 스팟. 타입a b c 전부 맛남.,1
5504,21160031,맛있어요,1
5505,21160031,커피 맛있어요ㅋㅋ추천! 비엔나도 맛있어요ㅋㄱ,1
5506,21160031,멋진 분위기와 친절한 직원들. 맛도 좋았음!,1
5507,21160031,서귀포에서 이렇게 맛난 커피를 마시다니! 행복하다,1
5508,21160031,"송산동커피 어르신들이 맛있다고 정말 잘 드시네요
사장님은 못 뵈었고 알바생이 만들어줬어요
분위기 유쾌하고 친절하구요
다음엔 사장님께서 만들어주는 거  마셔보고 싶네요
커피말고 다른 음료도 있어 아이랑 같이 가기에도 괜찮습니다",1
5509,21160031,집 앞에 있었으면 좋겠다....,1
5510,21160031,조오오오오오오오온맛.... 꼭 가게 안에서 드세요..!!,1
5511,21160031,지인짜 맛있어요. 근데 자리가 협소한 게 흠이예요.,1
5512,21160031,메가커피가 낫다,0
5513,21160031,메뉴중에 '송산동커피' 진짜 엄청 부드럽고 맛있어요!! 여행오면 매일 하루에 한잔씩 들릴 예정입니다ㅎㅎㅎ가격도 리뷰 그대로 진짜 저렴해요!! 의자도 엔틱하고 멋집니다ㅎㅎ,1
5514,21160031,직원들 너무 친절하고 맛도 있어요 이집 커피잘내립니다!! 제주도 오면 꼭 오는곳,1
5515,21160031,여기 커피 진짜 싸고 괜찮아요!!!! 강추강추,1
5516,21160031,"딸과 여행중 정류장앞이라 생각없이 들어왔는데 유동커피?라니 혹시 그집일까? 했는데 커피매니아들한테 유명한 바로 그집이네요.
아인슈페너 즉 비엔나커피를 마셨는데 역쉬 명불허전! 크림에 올려주는 아트도 예술입니다. 즐거운 추억 한줄 추가요~",1
5517,21160031,"우연히 지나가다 방문했는데 이렇게 유명한 카페인지 몰랐습니다. 
가격도 저렴하고 무엇보다 커피가 정말 맛있어요
사장님 직원분들 친절하시구요 
서귀포 오면 무조건 1일1유동커피합니다.",1
5518,21160031,"맛, 양, 가격 삼박자가 춤을 춤",1
5520,21160031,"왜 인기있는지 모르겠음
커피 못하는 집임 돈 아끼세요",0
5521,21160031,매장이 아늑했고 커피도 좋았습니다. 음악이 좀 시끄러웠던 것이 흠이라면 흠,1
5522,21160031,"동네의 보물 같은 카페네요.
커피 맛 좋고 분위기도 특색있고(그래도 좌석이 아예 없진 않아요. 20석 정도는 될듯?) 커피 값도 싼 편이에요. 
아메리카노 아이스랑 송산동커피랑 오레오쿠키 하나 시켰는데 만원 조금 넘게 나왔어요. 근처 들르시면 꼭 와보시길 추천합니다.",1
5523,21160031,"송산동커피가 시그니처라길래 냉큼 주문!
맛을 딱 봤는데 오우...이야... 
카라멜 마끼아또랑 비슷했는데 훨씬 부드럽고 살짝 더 달았다 ㅎㅎㅎ 평소에 엄청 단건 잘 안먹는데 오랜만이 먹어서 그런지 싹썩비웠다 ㅎㅎㅎ 존맛탱JMT
거게가 크진 않지만 실내화장실 있는건 굳~",1
5524,21160031,"커피 맛이 좋다고 해서 가봤는데
진짜 맛이 좋더라.",1
5525,21160031,"송산동 커피가 시그니쳐라고 합니다
딸기 크리미 먹음",1
5526,21160031,"공간이 매력있는건 아니지만 커피가 맛있었어요
테이크아웃으로 이용했는데 만족스러웠어요",1
5527,21160031,"직원 분의 미소가 
손님을 행복하게 해주는 미소예요 :)
기분 좋은 하루 만들어주셔서 감사합니다",1
5528,21160031,가성비 짱,1
5529,21160031,직원 친절하고 가격도 좋구,1
5530,21160031,"맛도 서비스도 좋은집.
단 주차공간은 건너편 무료 주차장 이용하세요. 
이중섭거리 내려오는 길에 주차장 있어요. ",1
5531,21160031,최고입니다!! 서귀포분들 부럽네요!!! 직원분들도 넘나 친절합니다!!!,1
5532,21160031,가격에 놀라고 맛에 놀라고. 동네 분들 부럽습니다.,1
5533,21160031,에스프레소 못드시는 분들 여기서 드셔 보세요. 왜 에스프레소를 마시는지 아실거에요.,1
5534,21160031,싸고. 맛있음,1
5536,21160031,Excellent coffee,1
5537,21160031,"장소엔 가보지는 않고 커피만 가지고 와서 지금 마시고 있는데 

처음 커피를 접하는 사람에게도 친근하게 다가가는 맛이네요 바리스타의 노력이 돋보입니다 
",1
5538,21160031,"2017.06.09 마님과 
드립 괜찮으나 싱글 오리진도 먹고싶다.",1
5539,21160031,"흑임자라떼: 진한데 많이 안달고 맛있어요
송산동라떼:그냥 달달한게 아니라 풍미가 엄청나고 부드럽고 난리남 강추추추
가격도 착하고 맛도 정말 좋아요",1
5540,21160031,"커피못마시는 사람도 송산동커피는 잘마실거같아요
부드럽고 대중적인 맛ㅠ
가격도 저렴하고 최고에요",1
5541,21160031,다소 좁은것만 참으면 정말 맛있는 커피를 먹을수있다. 여행중 비 촉촉하게 내릴때 지친 나의 몸과 마음을 위로해준 라떼를 잊을수없다,1
5542,21160031,커피라는 음식이 이런 맛이었구나,1
5543,21160031,"송산동커피 존맛이예요 이거드세요!!ㅜㅜ
송산동커피 뭐냐고물어보면 설명해주세요
주문기다리는데 송산동커피 주문 엄청하시고 송산동커피 나왔습니다 이러는거 많길래 물어보고 그냥 사봤는데 여기서만 맛볼수있는 맛입니당
초코크루아상도 맛있어용 평범하긴 한데",1
5544,21160031,"또 마시고 싶어요! 생각나는 맛...
물론 핸드드립 한잔에 7,000원 싼건 아니지만..
관광지인걸 생각하면 저렴하네요~~^^",1
5545,21160031,"좁아서 앉을자리도 없고 커피맛 좋은지도 모르겠고... 
강추받고 갔던곳인데  그닥 ㅡㅡ
별 하나도 안하고 싶은데 안되는거 같아서 걍 둔다.
",0
5546,21160031,로얄 밀크티(아이스) 5천원; 다소 비싸다. 다만 시나몬과 크림 뿌려준게 신의 한수. 늦은 시간에도 영업하며 사람들도 꽤 있다. 나름 지역 유명 가게인듯. 자리가 협소해 앉을 기대 없이 가는 것이 좋겠다.,1
5547,21160031,"커피맛도 좋고 비교적 저렴하고 맘에드는데
가게가 너무 좁아 앉을자리가 없고 복잡하네요 ㅠ
풍경을 즐길만한 위치는 아니니
테이크아웃 하는걸로^^",1
5551,21160031,Coffee,1
5553,21160031,이 가격에 이런 커피를!! 서귀포 가시면 꼭 가보세요,1
5554,21160031,사장님 최고네요~! 5월에 방문했었는데...,1
5555,21160031,나의 최애커피집!,1
5556,21160031,커피가 맛있어요 초코크로아상도 맛있어요,1
5557,21160031,B타입/쵸코크루아상 상상하고 기대하는 그 맛!!,1
5558,21160031,"저는 B타입이 맛있더라구요
송산동커피도 짱이고요
만점 쏩니다",1
5559,21160031,가성비 좋은 까페! 커피도 맛있어요~,1
5560,21160031,인스타용 이쁜 카페들 라떼가 5천원이 넘어가던데 여기는 3500원인데 다른 카페들보다 월등히 괜찮습니다.,1
5561,21160031,"개인적으로 관광지 카페의 서비스는 그다지 기대하지 않는편인데, 음료는 물론 직원분들과 사장님의 서비스가 너무 좋았어요. 굉장히 바쁜 시간대에 방문했는데도 불구하고 친절하셨고, 밀린 주문 때문에 혹시라도 음료 맛이 나쁘지는 않았는지 재차 물어봐주셔서 좋았어요.^^ 카페쇼나 세텍에서 하는 커피박람회에 자주 오시는 것 같던데, 서울에서 또 뵌다면 꼭 다시 마시고 싶을만큼 맛도 좋았습니다.",1
5562,21160031,커피랑 녹차라떼 너무 맛있네요. 계속 생각나요 ㅠㅠ,1
5563,21160031,"진짜 너무 맛있어요
3일째 가고있어요
카페모카 최고에요",1
5564,21160031,기본적으로 다 맛있습니다,1
5565,21160031,"저렴한 커피값 + 이보다 최소 다섯배 이상의 퀄리티
아늑한 동네 커피집 + 언밸러스함에도 인상적인 조화로움 가득한 인테리어 + 창밖 동네 풍경

프랜차이즈 말고 아늑한 동네 카페 원한다면 커피맛최고인 이곳으로! 제주에 있는 내내 자주 올 듯^^
지인들에게 소개해주고싶은 커피가게에요",1
5566,21160031,커피와 밀크티,1
5567,21160031,"분위기 - 커피맛  GOOD
다만 매장이 좀 작아서
앉아서 먹기 힘들듯?!",1
5568,21160031,"서귀포 분위기좋다는 카페 유동커피.  
맛을 구분할 정도는 못되고, 
아이스커피 마시면서 맛 구분을 한다는 게 모순이지...",1
5569,21160031,"아메리카노랑 비엔나커피
착한가격에 커피는 신선한거같은데 ...ㅋㅋ
내가 조아라하는 컵휘맛이 아님..
",1
5574,21160031,저렴하지만 저렴하지 않은 커피,1
5575,21160031,"커피에 천착한 사장님인듯~
에스프레소나 아메리카노는 A B C타입이 나눠져있어 취향에 따라 시킬수있다. 보통 라떼시키면 B타입을 넣어준다함.
라떼는 무난한데, 좀 중후하고 쓴맛이 느껴졌으며
A타입 아메리카노는 산미가 좀 있고 향수같이 아로마가 진해서 독특했다. 내취향은 아니었으나, 어쨌든 소울은 있는집 같음. 
(원두 판매할때 총각맛, 아저씨맛으로 구분해논게 웃겼음)",1
5577,21160031,"1. 이중섭거리 맞은 편, 주차장은 따로 없고 
   근처에 하고가여함.
2. 자리는 6-7개 정도. 
3. 밀크티와 아이스 아메리카노 c타입 맛있음.
    (아메리카노 스타일에 맞게 선택가능) 
4. 초코크라상 보통",1
5578,21160031,엄청 맛있는 밀크티와 초코 크로아상 강추!,1
5579,21160031,커피 무식자도 맛있게 먹음,1
5580,21160031,"슬러시같은 살얼음과 함께 나오는 아메리카노 값도 싸고 정말 맛있음! 
서귀포 근처에 간다면 꼭 들리자. ",1
5581,21160031,"내가 먹어본 커피중에 단연 최고였음.. A타입 아메리카노랑 라떼 먹었는데 아메리카노 추천
.담에 가서 B,C타입 다 먹어볼 예정",1
5582,21160031,커피숍의 분위기가 매력적인곳. 인상적인점은 커피를 3단계로 나누어 선택할 수 있다는 점이다. 그린티프라푸치노도 맛있다,1
5584,21160031,"가게는 아담하지만 커피 맛은 보증, 덕분에 드립백 구매, 특히 아재맛 문구가 예술",1
5586,21160031,커피 맛있음. 주인장 스타일이 날씬한 김어준이었는데....  가성비 갑이고 친절함,1
5588,21160031,아포카토가 너무 맛있어서 둘이 먹다 죽을뻔 했다...,1
5589,21160031,"아메리카노 : a, b, c로 나뉘는데 산미, 고소한 맛 등 취향에 따라 고를 수 있음. 장점은 무지 빠르게 나온다는 점. 가격 3천원

드립커피 : 개인적으로 드립커피 마시려고 찾아왔으나 대기시간이 너무 길어져 실망부터 함. 머신 음료를 시킨 뒷 손님들 주문 다 만들고 나서 주문이 안 밀릴때 드립커피를 만들기 때문에 기분이 상할 수 있음. 
가격 7천원

인테리어 : 빈티지하고 생각보다 테이블이
많지 않아 앉아서 마시려면 기다려야함. 

주차 : 평일이라면 근처 코너 뒤편에 있는 교회주차장 이용 가능

총평 : 아메리카노와 드립커피 외에 다른 메뉴는 먹어보지 않았기때문에 전체적으로 판단하기 어렵지만.. 
2년전에 왔을 때의 좋은 기억으로 재방문한 의미를 퇴색시켜버린 웨이팅 시스템..  
드립커피 만드는 시간이 오래 걸리는 것은 이해하겠으나, 왜 뒤에 온 손님 주문보다 늦게 만드는 건지는 이해가 안감.. 

아쉬워서 사장님 말고 직원분에게 컴플레인은 했는데 다시는 안 올 것 같음.. 

드립커피 시키실 분이라면 미리 기다릴 각오하고 가시길..",0
5590,21160031,최고!!!,1
5591,21160031,"제주 서귀포 이중섭거리 쪽에 위치한 유동커피 (바리스타 사장님 이름이 유동 이라고 하네요^^) 제주 도민ㅋ 동생이 소개해 함께 간 카페인데 와~ 들어서자 마자 벽 한켠에 가득 붙어있는 바리스타 자격증들이 대단대단 했어요^^

넓지 않은 1층 상가 실내인데 안쪽에는 로스팅 기계도 있고 직접 구워 판매하는 원두가 입소문 나서 많이 팔리더라구요~~ (일회용 드립 커피도 팔아요) 

주문한 커피가 나왔는데 앗!! 유동 사장님 얼굴이 라테 아트로 딱!!! 넘 놀랐어요 ^^ 잼있기도 하고... 가격대비 커피맛이 너무 좋았어요~~ 자몽라테도 역시 비쥬얼이!! 

커피를 다 마시니 빈 머그잔 센스 맨트가 딱!! ""음료는 입에 맞으셨나요?"" 네네^^ 커피 맛이 좋아서 담에 서귀포 놀러가면 또 가려구요~~~!! ",1
5593,21160031,쵝오의 커피.. 꼭 들러보길,1
5594,21160031,맛있음 짱!,1
5595,21160031,"A 타입 커피를 핸드드립으로 주문해서 마셨는데 커피향이나 맛이 7천원 가격에비해서는 조금 많이 아쉬운 맛이었습니다.
B 타입은 조금 진한 아메리카노로 주문해서 마셨는데 개인적으로 조금 평범한 맛이었어요..",1
5599,21160031,"커피 너무 맛있었어요! 아메리카노 A랑 C타입 마셔봤는데 C타입이 제 입맛에 더 맞았네요. 신맛 좋아하시는 분들은 A타입 추천ㅎ 시나몬허니 브래드도 맛있고, 커피 전문가이신 주인분도 친절하시고 좋았네용ㅎ 다음에 다시 들르고 싶은 카페네요😄",1
5600,21160031,"서귀포에서 가장 합리적인가격!!
그리고 최고의 원두커피 맛보장!!",1
5604,21160031,"서귀포에서 제일 맛있는 커피집!!--
아이스아메리카노 진하고 맛있었어요!",1
5605,21160031,"제주에서 찾기 힘든 로스터링카페 
핸드드립커피가  맛있음 ^^",0
5606,21160031,"제주여행중 마셨던 커피중 가장 맛있었던
사장님도 친절하시고 분위기도 좋고
강추합니다 ㅎㅎㅎ",0
5607,21160031,"2017년 11월부터 맛이 바뀌었어요. 사장님도 안보이시고... 최근에는 둘이 갔다가 거의 마시지 못하고 나왔습니다.      (2017.1.10 에 원래  썼던 글 -  제주 산지 15개월만에 유동커피를 처음 찾았습니다. 커피를 좋아해서 여기저기 다녀보는데, 단연코 최고네요. 서울에도 이 정도 맛있는 집은 흔치 않다 생각합니다. 가격도 싸서 놀랐습니다.)",0
5608,21160031,핸드드립만 두 번 먹어 보았어요. 7천원으로 비싸지만 시도해 볼 만 합니다. 진한 커피 좋아하는 분들에게 추천합니다.,1
5609,21160031,"카페인이 조금 쎈지 저한텐 조금 부담되긴 하지만, 따뜻한 카페모카는 여기보다 맛있는 곳을 아직 모르겠네요^^ 밀크티도 맛있고, 지인은 여기 아메리카노 극찬해서 원두 자주 사다가 드립해서 마시더라그여ㅋㅋ",1
5610,21160031,전에 제주도 왔다가 우연히 들린곳인데 커피 정말 맛있어요,1
5611,21160031,유동커피 마시러 제주 다시옴,1
5612,1665910227,괜찮아요  재방문은 글쎄요..,0
5613,1665910227,"너무너무 완벽한 정도는 아니지만
먹기전에 사진찍지 못하고, 다 먹고나서야 사진찍을 여유를 찾을 정도의 매력은 있는 곳이에요.",1
5614,1665910227,"헉 저는 맛있었고, 정말 친절하신 느낌을 받았는데요.ㅠㅠ
특히 겨울 제철 메뉴인 딸기케이크 정말 맛있어요",1
5615,1665910227,굳이 찾아가야할 필요성은 모르겠어요,0
5616,1665910227,"메뉴가 다양해서 좋아요
다들 친절하시고요
무화과 맛도 좋았습니다",1
5617,1665910227,"개 싸가지 없음 
정말 다시는 안간다. ",0
5618,1665910227,"넓고 브런치 정말 정말 맛있습니다 ㅠㅠㅠ
초코라떼가 시즌메뉴라 끝나서 아쉽네요",1
5619,1665910227,메뉴선택이 최악이였던듯... 저는 최악이였네요.. 엄청 맛없었어요.. 사진찍기도 ㅂㄹ 씨리얼은 예쁘게 나오네요~,0
5620,1665910227,"뭐 한번쯤 먹어보면 좋을
큐브토스트와 아보카도 오픈 토스트
가격이 너무 비싸다..",1
5621,27537482,"저는 샌드위치, 크로와상, 치즈식빵 주로 먹는데
진짜 맛있어요~ 
커피류는 제가 맛을 잘 몰라서 평가를 못하겠지만 
빵이랑 커피랑 먹으면서 책 읽고 오는데 괜찮습니다 
사람들이 많이 몰릴 때는 당연히 시끄럽지만
대체적으로 갈 때마다 분위기도 번잡스럽지 않았어요 
주차는 아주 넉넉합니다 
주문 받아주시는 남자 사장님? 암튼 조금만 더 미소 띄고 
서비스 해주시면 가게 인상이 더 좋아질것 같긴 하네여^^ ",1
5622,27537482,"사장인지 알바인지는 모르겠는데 인성별로네요. 

빵은 비싸기만하고 퍼석거려요. 
파운드는 촉촉하고 묵직한걸 기대하고 먹는건데 그런거 1도없고, 스콘은 무슨 과자인줄 알았어요.

이 돈 주고 사먹을바에야 딴데갑니다",0
5623,27537482,3대빵집,1
5624,27537482,"원래가던 빵집 2호점
주차도 되고 앉아 쉴 수 있는 자리도 있으나
빵이 1호점 보다 맛난것 같지 않다",1
5625,27537482,쵸코,1
5628,27537482,"커피도 맛나고
빵도 맛나고^^",1
5630,27537482,"최고의 커피향과 맛! 그리고 그 커피에 어울리는 맛있는 디저트 빵들... 분위기도 좋고, 직원들도 친절하고... 커피와 빵 모두 훌륭한 디저트 카페입니다. 적극 추천합니다.",1
5631,159378662,"해물라면 비추
버거도 그냥그럼. 둘다 12000원 값은 못함
사람이 많이 없어서 풍경 보면서 무난하게 먹긴 좋음",0
5632,159378662,"섬이란 것을 감안해서 먹을만한 곳
식당도 음식도 깔끔해서 좋았어요
해산물 떠주시는 분이 친절해서 기분 좋게 먹고 가요",1
5633,159378662,그냥저냥 해물라면 앞마당에서 바다보며 해산물에 소주 한잔 가능함 가격은 적당,0
5634,924513537,사장님 결혼 축하드립니다ㅋㅋㅋㅋㅋ 오는날이 장날이네요 담에 다시 올게요 ㅋㅋ,1
5635,924513537,"친절하게 서점 이용방법 다 설명해주시고,
자가용 여부 물어보신 후에
버스 노선, 시간까지 알려주시고

차 시원한 것 마시고 싶다하니
추천해주시며 향까지 맡아볼 수 있도록 해주시고

제가 구입한건 머핀, 차 뿐이었는데
읽고싶은 책들도 읽고
적은 시간, 지불한 돈에 비해
정말 많은걸 얻고 왔어요

베풀어주신 친절 기억하며
문득 다음 방문때까지 나누며 살고싶어졌네요

정말 고맙습니다 :)

Ps. &lsquo;시 밤&rsquo; 도서에 얼그레이 티 흘렸던 것
다시 한 번 죄송합니다ㅠㅠ",1
5636,924513537,조용한 공간에서 책을 읽고왔어요. 가까이 있으면 매일 갈 거에요.,1
5637,924513537,고양이도 사장님도 책도 홍차도 케이크도 최고!!!!!! 다음에 제주 올 때도 올거에요 ♡,1
5638,924513537,"사장님 친절하시고 분위기 너무 좋아요
책도 정말 많아서 전 너무 좋았어요 제주 올때마다 가려구요",1
5639,924513537,커피맛이 좋고 친절해요~ 책 읽기도 너무 좋아요!!,1
5640,924513537,"람이 넘 귀여워요 ㅠ.ㅠ  
다들 초코라떼 드세요 제발......
그리고 사장님 정말 친절하세여
선함이 얼굴에 드러남....",1
5641,924513537,디저트는 그저 그렇고... 음료나 공간은 정말 아주아주아주 최고. 카페에서 오래 있는 거 지루해서 안 좋아하는데 여긴 한 시간 반 있었는데도 나가는 게 아깝고 싫었음,1
5642,924513537,"찾아가기는 좀멀지만 시간여유가 있다면 가서 초코라떼와 책을 읽으며 제주를 즐겨보기 바란다.
",1
5643,924513537,최고,1
5644,924513537,"정말 분위기있고 편한 공간. 

커피맛도 좋습니다. 사장님도 너무 친절하세요. ^^",1
5645,924513537,"분위기 최고, 책도 정말 많아요~^^ 
에이드 먹었는데 맛있어요",1
5646,924513537,"차분하게 책 읽기 좋아요!
고양이도 있고 소소하게 쉬기 좋은 곳",1
5647,924513537,"다 좋아요.
다음엔 근처에 숙소 잡고 종일 있어야지.",1
